{
  "schema_version": 1,
  "run_id": "20261009-1000-baseline",
  "created_at": "2026-10-09T10:00:00Z",
  "record_state": "frozen",
  "source": {
    "commit": "1111111111111111111111111111111111111111"
  },
  "entrypoint": {
    "path": "src/main.py",
    "sha256": "3764318516d0eb12c5e04e4139e693f48ad8feead8deb2bc780f2bb620cbd5cb"
  },
  "config": {
    "path": "config.json",
    "sha256": "42009d3981eeadfc3851ec182277b4298a1e25fd497f67210bdbb51d1ee313d2"
  },
  "dataset": {
    "dataset_id": "synthetic-project-entry",
    "version": "1",
    "split": "fixed-fixture",
    "manifest": {
      "path": "config.json",
      "sha256": "42009d3981eeadfc3851ec182277b4298a1e25fd497f67210bdbb51d1ee313d2"
    }
  },
  "seed": 7,
  "environment": {
    "path": "config.json",
    "sha256": "42009d3981eeadfc3851ec182277b4298a1e25fd497f67210bdbb51d1ee313d2"
  },
  "recipe_hash": "aaaaaaaaaaaaaaaaaaaaaaaaaaaaaaaaaaaaaaaaaaaaaaaaaaaaaaaaaaaaaaaa"
}
