{
  "schema_version": 1,
  "run_id": "20261009-1300-conflict",
  "created_at": "2026-10-09T13:00:00Z",
  "record_state": "frozen",
  "source": {
    "commit": "1111111111111111111111111111111111111111"
  },
  "entrypoint": {
    "path": "src/main.py",
    "sha256": "3764318516d0eb12c5e04e4139e693f48ad8feead8deb2bc780f2bb620cbd5cb"
  },
  "config": {
    "path": "config.json",
    "sha256": "f68762ac4b9c3b522ebfe06748e8afef0b77c7a1af188734e1a069ed780d7e08"
  },
  "dataset": {
    "dataset_id": "synthetic-project-entry",
    "version": "1",
    "split": "fixed-fixture",
    "manifest": {
      "path": "config.json",
      "sha256": "f68762ac4b9c3b522ebfe06748e8afef0b77c7a1af188734e1a069ed780d7e08"
    }
  },
  "seed": 7,
  "environment": {
    "path": "config.json",
    "sha256": "f68762ac4b9c3b522ebfe06748e8afef0b77c7a1af188734e1a069ed780d7e08"
  },
  "recipe_hash": "eeeeeeeeeeeeeeeeeeeeeeeeeeeeeeeeeeeeeeeeeeeeeeeeeeeeeeeeeeeeeeee"
}
